{"command_id":"command-wait-gate-001","schema_version":"1.0.0","tenant_id":"tenant-ahd","project_id":"project-ahd-demo","run_id":"run-ahd-demo-0001","step_id":"1","correlation_id":"corr-ahd-demo-0001","idempotency_key":"idem-wait-gate-001","expected_revision":1,"integration_mode":"simulated","simulation_id":"sim-local-ahd-001","requested_at":"2026-08-19T09:14:00Z","command_type":"wait_for_gate","target":{"service":"workflow_api","operation":"wait"}}
